{
  "schemaVersion": 1,
  "contractRevision": "encrypted-upload-v2-contract-v1",
  "generatedBy": "cargo xtask encrypted-upload-v2 vectors generate",
  "keys": {
    "vectorRngSeedHex": "4242424242424242424242424242424242424242424242424242424242424242",
    "deviceRootKeyHex": "1111111111111111111111111111111111111111111111111111111111111111",
    "dataKeyHex": "2222222222222222222222222222222222222222222222222222222222222222",
    "backendP256SigningKeyHex": "3333333333333333333333333333333333333333333333333333333333333333",
    "backendP256PublicKeySpkiDerHex": "3059301306072a8648ce3d020106082a8648ce3d0301070342000451a7580833898ea1b183cbd7350a4099078c6ef1c1e18e970cd7683035f25e7d0110522712b0b5a7cff081685486984a94e6831edac46e7360fa9d834a7a81a1",
    "hpkeRecipientPrivateKeyHex": "4444444444444444444444444444444444444444444444444444444444444444",
    "hpkeRecipientPublicKeyHex": "ff2ee45601ec1b67310c7790404585ae697331eee1c1f8cf2419731c1fff3e6b",
    "recordingUuid": "00112233-4455-6677-8899-aabbccddeeff"
  },
  "cases": [
    {
      "name": "storage-partial-block",
      "category": "storage",
      "operation": "verifyStorageObject",
      "inputHex": "424f5441454e4332020080000100000001000100070000000010000000112233445566778899aabbccddeeff090000005555555555555555555555556666666666666666666666666fba3566c5b45c9fbe7e80bd4dd8f0e93c087e4b433a0140acc0dc5da07c2e39abce75540c562d00ee627ecada4c0fdc0000000000000000260000000fb45d5121e2c64b72e45aee688e26412df65b6df9d93106a17edb14c10ca8baf285ff22913e2a54110dcda16437e7d1df350df11256424f5441454e44320200900001010000010000002600000000000000ba000000000000004bca3ae0fcf137e0c7c1fe20e7b1c82afebd97d875f03f28de5ce5bc7de5cc493fa54a38e79dced2621991dddfda23a7b4d6752711157ec9cdc2b8df19e81d89000000000000000000000000b7b235d1538ef66f0db8141e2d00c4ebd2a15e622956f6b888d01924ef753038",
      "context": {
        "dataKeyHex": "2222222222222222222222222222222222222222222222222222222222222222"
      },
      "expected": {
        "normalized": {
          "blockCount": 1,
          "blockSize": 4096,
          "ciphertextLength": 330,
          "ciphertextSha256Hex": "287ad0258b5465b48757afe5f6980b7089fea7cb7520dc2db6d2fc9fd4fbfd1b",
          "formatVersion": 2,
          "plaintextLength": 38,
          "plaintextSha256Hex": "4bca3ae0fcf137e0c7c1fe20e7b1c82afebd97d875f03f28de5ce5bc7de5cc49",
          "recordingGeneration": 9,
          "recordingUuid": "00112233-4455-6677-8899-aabbccddeeff"
        }
      }
    },
    {
      "name": "storage-multi-block",
      "category": "storage",
      "operation": "verifyStorageObject",
      "inputHex": "424f5441454e4332020080000100000001000100070000000010000000112233445566778899aabbccddeeff090000005555555555555555555555556666666666666666666666666fba3566c5b45c9fbe7e80bd4dd8f0e93c087e4b433a0140acc0dc5da07c2e39abce75540c562d00ee627ecada4c0fdc00000000000000000010000040d238012582ae2f0894209101e7053b4d8b261f89e151239917a07da978d7c9f2c6b16ed670961660c2d3c4e80476314606392971a9c48af4578dbe013c0b3204f751c8867f13e60b69d26d6a76d6613dacaa5b19882de87e5660a3deb13360954e2c7b961e6ae206e76f72490f0363ed8386ebdc28a8dc95f204240d58b750bd669d9a29013642a2e347b3fd9ef08fa58b5a1a17a80d8168d169b47c3844a75ae171b6046d3a567fce2d72f223b5780f843de5ea486bf6e7392c3409b77e17dffe0fbd4f3b37220ab2f4f6b1ef63341942602f7b865a07365511975f1769b9de4f815baccf1c84f1f4402a1acc6cb4fe99273d8a5a1ef366a477eda19f0486168fc2a3d0bd484a2d3eb59786502fff9a7f0ce8950d88f8e6a9a92a1d9c9ad78099fb62c800e5cb618838853eda4464ef22e6a5bf9e06152f76ffc846d498adcf4e92c77893bdff63a80f010e08e0ab8a968b617fb4c9e2fab58c2ff59adf8a73c8ce772a4c2125118062fbc6d4300dab5955782b6ed99a69933107e4aa1f6b815bc68b43e7e8dff31763aad8d439d5e9b3551f0a8ec9ef10b46cd73d52c922ebdeae4c185e8449c8c4a8115355b10221adf5fb7ffc67b93cef20028b8e9a4d7325c04fbf3e9fc648772c6f862838f505270d559cabcce6be16d92a2431f958cdcfa7a6a7274219559295994aec8098f1b370b66ff7283eb50e32601a2c5b08022daea52167abb898a27babec12b47e4de3ccd90a5a0e921b7589a132e23f725b727a3cf58272de4679f32eadd23e7cc0531ba05099a7e14b881081d5279563892d9098874f99c57f4615e4e0477ddd146f277d329e0262afed0d888bce23a3226537af07008e2374f6f8fa3e2bc774c2cbc7c29acdfcbda384eb907a2980a4a07bb9da42aba209275f864890919f0f57d8a3a9acafb4d2f2cce3ca83c44071c4df6747976483cd9d8c1420d75086e6f42fbcbdb91b64ff16c564dd6a503a655b32385cba1c1ffc8c3ec95738a022ab1e31681b725bfff41490c77d9c66652ba26a8b5ee10805571e96456fa0450c5ab6a339744f2fa1a901c055b082424dc5502784b465d68d609ff9e9d223fc16be3971c8a45e6f6b30f5129099b7cab70f00aeb0ba86fe6b187819bd81ee68a9850428c5e9176f257afc03351f0d9161a2f24b426ca89e62b1b08e8f7775648224dba7b52cadd8975e355e418bb94e75a10149adb28b127ea11ff128f53e0b88f98ff19bc2e4c83d0a485a210333353a74d8f76b452be1b63c621921ffaf231c9f21991cefa7308712760f7780983e1a2af5c115a48ffbcb73515d1af8c317c80ad99682ae8671ad2a55341a5a6bab9845c2f5198e0d49ef0a38d0a17fc831404f85722a48e923cb107f0d1c8fb9303e1240a083fb31a0b2d0b4b34e12a8b1146f66790af7941107fb34d47d56615f4b3c9bb9a09917a92f6cf2b0bcf6133d2a8600d88b0e93d9f1dfef8a2070324545cf07f60f1f0ce434651bbb376f68f8b50ee4e12671e841f5622c03bf38fdfc25a95e0005034d12550829b7e81a2703cb2edaa1f3e5344984320161e51ed59a621f7a0451d9f3848ec2d30cc4260d2fc632b025d7321e737d8d84afcf48d89166a81b6f10f21a66d037e98df2d2786e197351adb5357abc92757a064df6caff825c9f2b73289fc7a0dc3e36cf94b56e285f6d940a345b958e3f1243e26ae5c758dc56daa3e9f13ce761a6b8308e5834bd6319f4489eeb56cd65682ccd959217843fbd49f42257bcfa2dd5c85e5f216045b524e2b0ec1fd5840fef651d5f9941a4fab2561087a870142ec6e873f0695e28fdc90c147a226a5c344ad37727e9f98bfef1a316f353f491a6a3d222c770880c0cf1ce080ae235e5868fcbefe78807fbb068e348b2bad774b94d9034959805ffa04d38f80ae50daa2a2d88d184af5faa962d628ba7494e8b1af76697360f947ed9d92950c17ee064c17ede20892c156d53e1f0f1413ca216b80227a16169f553094b5e7fc5cb45ace6d5f8f0ea6a5106b6926215db79970fbb9892cad4f05c2d730fac4da9fec4ee557be92fe56e0b59984bba0a75255c97434094ca2a4ac40c4109e81dcb64d7215228db15bf8280cdcbdc5ff876be207046d5c6db4972b3ad86c86f135b36c02b7c0b6bb7a9014e3c39522ccdf79812ce1579bcb4db38c54f7de8ae2ea6df812a4a669ec34b281a9d5031c427c4099231b4d62b94ade4ec90d136ae5095b13e817dd97812bb152ee3715d8e767ef95ece4b0077fea41c54c8b44149922c037b05c545539272b815953688aab5a3b2f957fb5319251ccfec1ece65808dbf5cc5b51e8a0698653f9ab7fe926a09a24aa47faa2acc6adb909ab5b2f8fb00eb6e363029593d08a42f7570037db08a09819095cc0b96816590baca69244485b40de5c413d529d8793eb5d9641bf02950d24c4ce3d3e549c166501fbd089c5b2e9e0a6ddc6e194d7cb729461a8b1d4efe8730a01669fc8e861d9f918b91368aa4f579bdff083b43f4ba8d3f31403dc39902f066595c477e0367bf2f41b8a5b777ca34b5763e567fd3c439f64b278d5c7382f8d802d5137d549270b4f1b50bea694e6991f39285d126cf90dc9c65adc9195761c3d4632886d03e32de3f3f03235f09ca20779ec4f147c1c4e1cf17c0b2b69b1f3e8b07edfdfd0631fa924b7059a41c7e701818e543486401144e3f460ae25d07c0be8387ce44253270a003d661238d008c1f5634fb6b43da0de9b7b912c1d9afd6411aeb5cb1b394c423c033a5e64181b9532d0cf08854caa5023b71466183891f53f7e97d23c67e97dd07ba2c022de13a9c56d37a9c663366cba7356f0e2128a772934b7dee4cd58d03f301dde58bb50d0683cff45e1fd26fef58771db79aab80149875f3a16b14ca704dd7996a0a678284075ece44349b273f5dea9f1c9ee1c47cfe3d704ee7a3df89198512994ae1f6a3873fe3f870534bdcd553f3df0dfdd593904957a9513e5a3e8b34c5a84903cc50025eca1ff8cb641928b23edc53fdfca60c87dba072a13f46db083ddf6217a8211d9c529490db2a921f1c834a788cac15247c34d43019ee4167089533c8f3bd7c323d07edc0fc9587006054900126745641c9e2580a36bd09153cd4a9a0d5d3aababea1fdba968a6ea40d282f93098a08f065e5331a769cc6c30b3fa225cfab2f38ee846d618b8e960292d0522594f557c3da81ac974cf2c4a1522d8ec077ba803fc622ecc56468a883ec66a673d758a910495af39746ef3ba485e417a169907dae0349b0150cf514ce745e86df831df6ecf25451a28157f5d7ae3e39b51ccbee728ec53b4e184c53e50d91f9871d50baa56f4b3cdb89f07ad4f944c640855e57ffef952adf899da01f11a8dae09ae0aefd3888f9b90d90bfb95513ed8b5224de345bb4e02f68428a74c8bfad32a6c0dcbddcc5dff1125d15e488c0879e8d4667e9d7fdfb1951b462a36c4d91cf7466177126e1142ad4bebf37684911cc25bff45534da2519b3c7d560364b98a28349377ceaa4a05d42f09e3b198c28c3775e2f4c1991cc4ec1692f16ec55fcb9329cb21738d8b3bdc79e2c3687051794b5673734bbb3c532d31ef7c9ba108b110b5fb5ac7b9cb577764b583dbc855008e28ec3c589093a862ce35bb212dd9341c1cb3656b8433e9e35260a7fa312b56ddb81fc0bb177087a7574096ff0b02e684df87c2c0b842fda3e3db290f1333da0c05fb0e22ac7727024a89b68ce6a10aada0ac629aad857da2d4586b59fbc70bd0206a347021fb84c22994418d93d3fe85e2939b7c18694ce90af20a48e03699618cfe6b27186c169bcc80688296e6024b100582e09ed4b357462eb3dd455bb2a69e6f3abde00f9be3fb684d2ec7acf58e323a34ce94be82bc7db3402a8965eb7fd7c9bbf7ca91a84cd635080688cac99a01796ec48e3d20661a35b426fcbde4436b46bcfa1907397fc896d9e3bdb7d31965a51f85b4aaf9737d99daeeef47985eea9626b9cfe9a5611f5d90b320731690c4f151f51e3d464a103169a5146697792b9e58dbe43431d0c81b189a1414f737279029e632e6d21f3c5d6f1c56f3ecb4d4bf88ee0ca31bf32eaa3af59bdf24021d11cadab625958a7129eb6ad7b4de5eae541416bef10488c311f20e3bf5d89d504d1a05275afad0fcaadb26084d0d2dce9a5d395dd8cb5d7d462338c61b58c8e26b84b30fb05032081233e9a8457f9326d3adb84593c032682799b8e066609520910eb54ec7957204df6c4da8bc862225c51046d362ddfcb29b04b0133de8eb92bdb23b27ab03220529ab224b4cca33ccfd50e27e962477e94d0a0d0536746c826d070ec6d08f1ff9e9053bf375b5fdfcb1343ef065af5629cc4581fa0733c5903025c5a229137b9838ceeeb07afd19d63ff558c4ad200ea3eb8b0e89fd3f13b892a51a02dae23928a4380ff32b5821f14485c5d8d79c82c4d80edf35561e9cfaa820ea81687e4999d44ab60c2879d3696197c6452e1aaf5d1e8f4f09e3081c4e3e78b6cbe60135742693d4c7d962b0e961baf46eb29303c96ad2e4718528d2422ba1ba82fdf7f3d7a8fd781f988ad1034cf4b74ac3039044c480a67d91e25442fcd28d7361ba6f8bf5495fe32f26bbbd747b7feeeb8c15d313d7b4d684a5e75e23204b0d8163a40032bc94052e3d37fd39cdb48aff024671437f98e5c67c750d0498ebf7136481bb89378a889968a4393014ae33f58d6cb789bfdc7e3560dd1748d53659ffb9d36ec07d0919f393d9e49062f40b83170880832914e62664ef0642a8d6a37b8bdaef139e3c8e22e462d8c82dfc5c92b687e718ec38795c02dc2c338c58da13edfd49e5de9a9ea467504f401306d2b368f2ceeab1c88a8c265a543237ed282ef5568b2e4885553b059b5f5e9c14d27f27854c63a705076ae8bbeaf809983ad4bda212ac468bf88dfde7b025fd53e3c984236eadbf8adc9518b9b2f4ae92b81687f81c56e65cbd3c5b1b1892ad3eb2e67681e1b6a6b6136648d720e72de089